index,content,token
1053,Thank you for dreaming about a beautiful future and creating it along the way.,78
1054,And thank you so much for spending your really valuable time with me today.,75
1055,This was awesome.,17
1056,This was my pleasure and you have some great insights both into me and into humanity as well.,93
1057,So I appreciate that.,21
1058,Thanks for listening to this conversation with Ray Kurzweil.,60
1059,"To support this podcast, please check out our sponsors in the description.",74
1060,And now let me leave you with some words from Isaac Asimov.,59
1061,"It is change, continuous change, inevitable change that is the dominant factor in society today.",96
1062,"No sensible decision could be made any longer without taking into account not only the world as it is, but the world as it will be.",131
1063,"This in turn means that our statesmen, our businessmen, our every man must take on a science-fictional way of thinking.",119
1064,Thank you for listening and hope to see you next time.,54
