index,content,token
361,"And so basically, this is looking at the increase in the not transistors, but the computational power of neural networks.",121
362,"Yes, the computational power that created these models.",55
363,And that's doubled every six months.,36
364,She's even faster than transistor division.,43
365,Yeah.,5
366,"Actually, since I got faster than the amount of cost, this has actually become a greater investment to create these.",116
367,"But at any rate, by the time you get to 2045, we'll be able to multiply our intelligence many millions full.",108
368,And it's just very hard to imagine what that will be like.,58
369,And that's the singularity where we can't even imagine.,55
370,Right.,6
371,That's why we call it the singularity.,38
372,"The singularity in physics, something gets sucked into it singularity.",70
373,And you can't tell what's going on in there because no information can get out of it.,85
374,There's various problems with that.,35
375,But that's the idea.,20
376,It's too much beyond what we can imagine.,41
377,Do you think it's possible we don't notice that what the singularity actually feels like is we just live through it with exponentially increasing cognitive capabilities.,169
378,"And we almost, because everything's moving so quickly, don't aren't really able to introspect that our life has changed.",120
379,Yeah.,5
380,"But I mean, we will have that much greater capacity to understand things.",73
381,"So we should be able to look back looking at history, understand history.",73
382,But we will need people basically like you and me to actually think about these things.,87
383,Think about it.,15
384,But we might be distracted by all the other sources of entertainment and fun because the exponential power of intellect is growing.,131
385,"But also, there'll be a lot of fun.",35
386,"The amount of ways you can have, you know, I mean, we already have a lot of fun with computer games and so on that are really quite remarkable.",143
387,"What do you think about the digital world, the metaverse virtual reality?",73
388,Will that have a component in this or will most of our advancement be in physical?,82
389,"Well, that's a little bit like second life, although the second life actually didn't work very well because it couldn't actually handle too many people.",152
390,And I don't think the metaverse has come to being.,50
391,I think there will be something like that that will necessarily be from that one company.,89
392,"I mean, there's going to be competitors.",40
393,"But yes, we're going to live increasingly online.",49
394,"And particularly when if our brains are online, I mean, how could we not be online?",83
395,"Do you think it's possible that given this merger with AI, most of our meaningful interactions will be in this virtual world, most of our life, we fall in love, we make friends, we come up with ideas, we do collaborations, we have fun.",235
396,"Actually, no somebody who's marrying somebody that they never met.",66
397,Yeah.,5
398,"I think they just met her briefly before the wedding, but she actually fell in love with this other person, never having met them.",130
399,And I think the love is real.,29
400,So that's a beautiful story.,28
401,"But do you think that story is one that might be experienced as opposed to by hundreds of thousands of people, but instead by hundreds of millions of people?",157
402,"I mean, it really gives you appreciation for these virtual ways of communicating.",81
403,"And if anybody can do it, then it's really not such a freak story.",66
404,So I think more and more people will do that.,45
405,But that's turning our back on our entire history of evolution.,63
406,"Or the old days we used to fall in love by holding hands and sitting by the fire, that kind of stuff.",101
407,"Here you're actually have five patents on where you can hold hands, even if you're separated.",93
408,Great.,6
409,"So the touch, the sense, it's all just senses.",46
410,It's all just.,14
411,Yeah.,5
412,"I mean, it's not just that you're touching someone or not.",58
413,There's a whole way of doing it.,32
414,And it's a very subtle and but ultimately we can emulate all of that.,69
415,Are you excited about that future?,34
416,Do you worry about that future?,31
417,"I've certainly worried about the future, but not that virtual touch.",68
418,"Well, I agree with you.",23
419,You described six stages in the evolution of information processing in the universe as you started to describe.,111
420,"Can you maybe talk through some of those stages from the physics and chemistry to DNA and brains and then to the to the very end, to the very beautiful end of this process?",172
421,It actually gets more rapid.,28
422,"So physics and chemistry, that's how we started.",48
423,So we had very beginning of the universe.,41
424,We had lots of electrons and first things traveling around.,59
425,"And that took actually many billions of years, kind of jumping ahead here to kind of some of the last stages where we have things like love and creativity.",155
426,It's really quite remarkable that that happens.,47
427,But finally physics and chemistry created biology and DNA.,58
428,And now you had actually one type of molecule that described the cutting edge of this process.,94
429,And we go from physics and chemistry to biology.,48
430,And finally biology created brains.,35
431,Not everything that's created by biology has a brain.,53
432,But eventually brains came along.,33
433,And all of this is happening faster and faster.,47
434,Yeah.,5
435,It created increasingly complex organisms.,42
436,"Another key thing is actually not just brains, but our thumb.",61
437,Because there's a lot of animals with brains even bigger than humans.,69
438,"I mean, elephants have a bigger brain.",38
439,Whales have a bigger brain.,27
440,But they've not created technology because they don't have a thumb.,67
441,So that's one of the really key elements in the evolution of humans.,68
442,"This physical manipulator device, that's useful for puzzle solving in the physical reality.",91
443,"So I could think they could look at a tree and go, oh, I could actually trip that branch down and eliminate the leaves and carve a tip on it and create technology.",163
444,And you can't do that if you don't have a thumb.,48
445,So thumbs and created technology and technology also had a memory.,66
446,And now those memories are competing with the scale and scope of human beings.,78
447,And ultimately we'll go beyond it.,34
448,"And then we're going to merge human technology with human intelligence and understand how human intelligence works, which I think we already do.",144
449,And we're putting that into our human technology.,49
450,So create the technology inspired by our own intelligence and then that technology supersedes us in terms of its capabilities.,126
451,And we ride along.,18
452,Or do you do you ultimately see it as fun?,42
453,"We ride along, but a lot of people don't see that.",50
454,"They say, well, you've got humans and then you've got machines and there's no way we can alter the league compete with humans.",126
455,And you can already see that.,29
456,Leads of dolls who's like the best go player in the world.,58
457,So if he's not going to play Go anymore.,40
458,Yeah.,5
459,"Because playing Go for human, that was like the ultimate in intelligence because no one else could do that.",107
460,But now a machine can actually go way beyond him.,49
461,"And so he says, well, there's no point playing it anymore.",58
462,That may be more true for games than it is for life.,52
463,I think there's a lot of benefit to working together with AI in regular life.,77
464,"So if you were to put a probability on it, is it more likely that we merge with AI or AI replaces us?",101
465,A lot of people just think computers come along and they compete with them.,75
466,We can't really compete.,24
467,And that's the end of it.,25
468,As opposed to them increasing our abilities.,44
469,"And if you look at most technology, it increases our abilities.",63
470,Look at the history of work.,28
471,Look at what people did 100 years ago.,38
472,Does any of that exist anymore?,31
473,"I mean, if you were to predict that all of these jobs would go away and it would be done by machines, people would say, well, no one's going to have jobs.",154
474,It's going to be massive unemployment.,38
475,"But I show in this book, this coming out, the amount of people that are working, even as a percentage of the population has come way up.",136
476,We're looking at the X-axis year from 1774 to 2024.,51
477,And on the Y-axis personal income per capita in constant dollars and it's growing super linearly.,97
478,"I mean, it's 2021 constant dollars and it's gone way up.",56
479,"That's not what you were to predict, given that we were to predict that all these jobs would go away.",101
480,But the reason it's gone up is because we've basically enhanced our own capabilities by using these machines as opposed to them just competing with us.,151
481,That's a key way in which we're going to be able to become far smarter than we are now by increasing the number of different primitives we can consider in making a decision.,173
482,I was very fortunate.,21
483,"I am very fortunate to be able to get a glimpse preview of your upcoming book, Singularity's Nearer.",100
484,"And one of the themes outside of just discussing the increasing exponential growth of technology, one of the themes is that things are getting better in all aspects of life.",173
485,And you talk just about just about this.,40
486,So one of the things you're saying is with jobs.,48
487,So let me just ask about that.,30
488,"There is a big concern that automation, especially powerful AI will get rid of jobs.",84
489,People will lose jobs.,22
490,"And as you were saying, the senses throughout history of the 20th century automation did not do that ultimately.",112
491,"So the question is, will this time be different?",48
492,Right.,6
493,That is the question.,21
494,Will this time be different?,28
495,And it really has to do with how quickly we can merge with this type of intelligence.,85
496,"With a Lambda GPT-3 is out there, maybe it's overcome some of its key problems.",79
497,And we really have an enhanced human intelligence that might be a negative scenario.,84
498,"But I mean, that's why we create technologies to enhance ourselves.",67
499,And I believe we will be enhanced when I'm just going to sit here with 300 million modules in our Neo Cortex.,109
500,We're going to be able to go beyond that.,41
501,"Because that's useful, but we can multiply that by 10, 100,000 million.",71
502,"And you might think, well, what's the point of doing that?",58
503,"It's like asking somebody that's never heard music, well, what's the value of music?",84
504,"I mean, you can't appreciate it until you've created it.",56
505,There's some worry that there will be a wealth disparity.,57
506,"You know, a class or wealth disparity, only the rich people will be.",68
507,"Basically, the rich people will first have access to this kind of thing.",72
508,"And then because of this kind of thing, because the ability to merge will get richer, exponentially faster.",107
509,And I say that's just like cell phones.,39
510,"I mean, there's like four billion cell phones in the world today.",65
511,"In fact, cell phones first came out.",36
512,You had to be fairly wealthy.,29
513,They weren't very inexpensive.,30
514,So you'd have some wealth in order to afford them.,50
515,"Yeah, there were these big, sexy phones.",40
516,And they didn't work very well.,31
517,They did almost nothing.,24
518,So you can only afford these things if you're wealthy at a point where they really don't work very well.,104
519,So achieving scale is and making it inexpensive is part of making a thing more.,79
520,Exactly.,8
521,"So these are not totally cheap, but they're pretty cheap.",57
522,"I mean, you can get them for a few hundred dollars.",51
523,Especially given the kind of things that provides for you.,58
524,"There's a lot of people in the third world that have very little, but they have a smartphone.",93
525,"Yeah, absolutely.",17
526,And the same will be true with AI.,34
527,"I mean, I see homeless people have their own cell phones.",57
528,"Yeah, so your sense is any kind of advanced technology will take the same trajectory.",85
529,Right.,6
530,It also becomes cheap and will be affordable.,45
531,I probably would not be the first person to put something in my brain to connect to computers.,94
532,Because I think it will have limitations.,41
533,"But once it's really perfected, at that point it will be pretty inexpensive.",76
534,I think it will be pretty affordable.,37
535,"So in which other ways, as you outline your book, is life getting better?",73
536,"Because I think, well, I have, I mean, I have 50 charts in there.",65
537,"Yeah, where everything is getting better.",41
538,"I think there's a kind of cynicism about, even if we look at extreme poverty, for example.",90
539,"For example, this is actually a poll taken on extreme poverty.",62
540,"And the people who were asked, his poverty got better or worse.",63
541,"And the options are increased by 50% increased by 25% remain the same, decreased by 25% decreased by 50%.",105
542,"If you're watching this or listening to this, try to try to vote for yourself.",78
543,70% thought it had gotten worse.,32
544,And that's the general impression.,34
545,88% thought it had gotten worse or remained the same.,53
546,Only 1% thought it decreased by 50%.,36
547,And that is the answer.,23
548,It actually decreased by 50%.,29
549,So only 1% of people got the right optimistic estimate of how poverty is.,73
550,Right.,6
551,And this is the reality.,24
552,And it's true of almost everything you look at.,47
553,You don't want to go back 100 years or 50 years.,48
554,"Things were quite miserable then, but we tend not to remember that.",67
555,"So literacy rate increasing over the past few centuries across all the different nations, nearly to 100% across many of the nations in the world.",145
556,It's gone way up average years of education have gone way up.,61
557,Life expectancy is also increasing.,35
558,Life expectancy was 48 in 1900.,31
559,And it's over 80 now.,21
560,"And it's going to continue to go up, particularly as we get into more advanced stages of simulated biology.",107
561,"For life expectancy, these trends are the same for at birth, age 1, age 5, age 10.",82
562,So it's not just the infer mortality.,37
563,I have 50 more graphs in the book about all kinds of things.,60
564,"Even spread of democracy, which might bring up some controversial issues, it still has gone way up.",99
565,"Well, that one is gone way up, but that one is a bumpy road, right?",67
566,Exactly.,8
567,"And somebody might represent democracy and go backwards, but we basically had no democracies before the creation of the United States, which was a lot of two centuries ago, which is in the scale of human history isn't that long.",228
568,Do you think super intelligent systems will help with democracy?,64
569,So what is democracy?,21
570,Democracy is giving a voice to the populace.,44
571,"And having their ideas, having their beliefs, having their views represented.",77
572,"Well, I hope so.",16
573,"I mean, we've seen social networks can spread conspiracy theories, which have been quite negative, being, for example, being against any kind of stuff that would help your health.",179
574,"So those kinds of ideas have, on social media, you notice is they increase engagement.",86
575,So dramatic division increases engagement.,42
576,Do you worry about AI systems that will learn to maximize that division?,72
577,"I mean, I do have some concerns about this.",43
578,"And I have a chapter on the book about the perils of advanced AI, spreading misinformation on social networks is one of them, but there are many others.",152
579,What's the one that worries you the most?,41
580,That we should think about to try to avoid?,43
581,"Well, it's hard to choose.",26
582,We do have the nuclear power that evolved when I was a child.,61
583,"I remember in, we would actually do these drills against a nuclear war.",71
584,We'd get under our desks and put our hands behind our heads to protect us from a nuclear war.,93
585,Seems to work.,14
586,We're still around.,19
587,"You're protected, but that's still a concern.",45
588,"And there are key, dangerous situations that can take place in biology, someone could create a virus that's very, I mean, we have viruses that are hard to spread and they can be very dangerous.",193
589,"And we have viruses that are easy to spread, but they're not so dangerous.",74
590,Somebody could create something that would be very easy to spread and very dangerous and be very hard to stop.,110
591,"It could be something that would spread without people noticing because people could get it, they'd have no symptoms, and then everybody would get it, and then symptoms would occur maybe a month later.",201
592,"And that actually doesn't occur normally because if we were to have a problem with that, we wouldn't exist.",107
593,So the fact that humans exist means that we don't have viruses that can spread easily and kill us because otherwise we wouldn't exist.,134
594,"Yeah, viruses don't want to do that.",36
595,They want to spread and keep the host alive somewhat.,53
596,"So you can describe various dangers with biology, also nanotechnology, which we actually haven't experienced yet, but there are people that creating nanotechnology and it's carved out in the book.",196
597,"Now you're excited by the possibilities of nanotechnology, of nanobots, of being able to do things inside our body, inside our mind that's going to help.",153
598,What's exciting?,16
599,What's terrifying about nanobots?,33
600,What's exciting is that that's a way to communicate with our neocortex because each neocortex is pretty small and you need a small entity that can actually get in there and establish a communication channel.,207
601,And that's going to really be necessary to connect our brains to AI within ourselves because otherwise it would be hard for us to compete with it.,146
602,"You know, high bandwidth way.",29
603,Yeah.,5
604,And that's key actually because a lot of the things like neural link are really not high bandwidth here.,104
605,So nanobots is the way you achieve high bandwidth.,50
606,How much intelligence would those nanobots have?,48
607,"Yeah, they don't need a lot.",28
608,Just enough to basically establish communication channel to one nanobots.,73
609,So it's primarily about communication between external computing devices and our biological thinking machine.,109
610,What worries you about nanobots?,32
611,Is it similar to the viruses?,29
612,"Well, I mean, that's the great good challenge.",46
613,Yes.,4
614,"If you have a nanobot that wanted to create any kind of entity and repeat itself and was able to operate in a natural environment, you could turn everything into that entity and basically destroy all biological life.",216
615,So you mentioned nuclear weapons.,33
616,Yeah.,5
617,I'd love to hear your opinion about the 21st century and whether you think we might destroy ourselves.,102
618,"And maybe your opinion, if it has changed by looking at what's going on in Ukraine, that we could have a hot war with nuclear powers involved and the tensions building and the seeming forgetting of how terrifying and destructive nuclear weapons are.",249
619,Do you think humans might destroy ourselves in the 21st century and if we do how?,81
620,And how do I avoid it?,22
621,I don't think that's going to happen.,37
622,"Despite the terrors of that war, it is a possibility.",53
623,"But I mean, I don't.",20
624,It's unlikely in your mind.,27
625,Yeah.,5
626,"Even with the tensions we've had with this one, nuclear power plant that's been taken over, it's very tense.",108
627,But I don't actually see a lot of people worrying that that's going to happen.,78
628,I think we'll avoid that.,25
629,We had two nuclear bombs go off in 45.,38
630,"So now we're 70, 7 years later.",31
631,"Yeah, we're doing pretty good.",30
632,We've never had another one go off through anger.,49
633,"People forget, people forget the lessons of history.",52
634,"Well, yeah.",11
635,"I mean, I am worried about it.",30
636,"I mean, that's definitely a challenge.",38
637,But you believe that we'll make it out and ultimately super intelligent AI will help us make it out as opposed to destroy us.,125
638,I think so.,11
639,But we do have to be mindful of these dangers.,46
640,And there are other dangers besides nuclear weapons.,52
641,"So to get back to merging with AI, we'd be able to upload our mind in a computer in a way where we might even transcend the constraints of our bodies.",150
642,So copy our mind into a computer and leave the body behind.,59
643,Let me describe one thing I've already done with my father.,59
644,That's a great story.,21
645,So we created a technology.,27
646,This is public came out six years ago where you could ask any question.,71
647,"And the release product, which I think is still on the market, it would read 200,000 books.",91
648,"And then find the one sentence in 200,000 books that best answered your question.",81
649,It's actually quite interesting.,32
650,You can ask all kinds of questions.,35
651,"And you get the best answer in 200,000 books.",45
652,"But I was also able to take it and not go through 200,000 books, but go through a book that I put together, which is basically everything my father had written.",160
653,"So everything he had written, I had gathered, and we created a book.",68
654,Everything that Frederick Roosevelt had written.,48
655,"Now, I didn't think this actually would work that well because stuff he'd written was stuff about how to lay out.",113
656,"I mean, he did corrected choral groups and music groups.",56
657,"And he would be laying out how the people should, where they should sit and how to fund this.",93
658,And all kinds of things that really weren't didn't seem that interesting.,73
659,"And yet, when you ask a question, it would go through it and it would actually give you a very good answer.",107
660,"So, you know, who's the most interesting composer?",50
661,"And he said, well, definitely Brahms.",37
662,And he would go on about how Brahms was fabulous and talk about the importance of music education.,98
663,"So you could have a conversation with him, which was actually more interesting than talking to him because if you talk to him, he'd be concerned about how they're going to lay out this property to give a choral group.",217
664,He'd be concerned about the day to day versus the big question.,63
665,Exactly.,8
666,"And you did ask about the meaning of life and he answered, love.",64
667,Yeah.,5
668,Do you miss him?,16
669,"Yes, I do.",10
670,You get used to missing somebody after 52 years.,48
671,And I didn't really have intelligent conversations with him until later in life.,80
672,"In the last few years, he was sick, which meant he was home a lot and I was actually able to talk to him about different things like music and other things.",156
673,And so I missed that very much.,31
674,What did you learn about life from your father?,47
675,What part of him is with you now?,33
676,"He was devoted to music and when he would create something to music, he'd put them in a different world.",104
677,"Otherwise, he was very shy.",27
678,"And if people got together, he'd tell it not to interact with people just because of his shyness.",97
679,"But when he created music, he was like a different person.",58
680,Do you have that in you that kind of light that shines?,55
681,"I mean, I got involved with technology at age five.",51
682,And you found love with it in the same way he did with music?,61
683,Yeah.,5
684,I remember this actually happened with my grandmother.,54
685,"She had a manual typewriter and she wrote a book, One Life is Not Enough.",73
686,It's actually a good title for a book.,38
687,"I might write, but it was about a school she had created.",57
688,"Well, actually her mother created it.",37
689,So my mother's mother's mother created the school in 1868.,58
690,And it was the first school in Europe that provided higher education for girls.,79
691,It went through 14th grade.,27
692,"If you were a girl and you were lucky enough to get an education at all, it would go through like 9th grade.",108
693,And many people didn't have any education as a girl.,52
694,This went through 14th grade.,29
695,Her mother created it.,22
696,She took it over.,17
697,And the book was about the history of the school and her involvement with it.,77
698,"When she presented to me, I was not so interested in the story of the of the school.",84
699,But I was totally amazed with this manual typewriter.,53
700,"I mean, here was something you could put a blank piece of paper into and you could turn it into something that looked like it came from a book.",143
701,And you could actually type on it.,34
702,It looked like it came from a book.,35
703,It was just amazing to me.,26
704,And I could see actually how it worked.,39
705,And I was also interested in magic.,35
706,"But in magic, if somebody actually knows how it works, the magic goes away.",75
707,The magic doesn't stay there if you actually understand how it works.,69
708,But he was technology.,22
709,I didn't have that word when I was five or six.,47
710,And the magic was still there for you?,38
711,"The magic was still there, even if you knew how it worked.",58
712,"So I became totally interested in this and then went around, collected little pieces of mechanical objects from bicycles, from broken radios, I would go through the neighborhood.",178
713,This was an era where you would allow five or six year olds to like run through the neighborhood and do this.,109
